abstract,authors,chembl_release,contact,database_version,doc_type,document_chembl_id,doi,doi_chembl,extracted_at,first_page,hash_business_key,hash_row,index,issue,journal,journal_full_title,last_page,patent_id,pubmed_id,score,src_id,title,volume,year
11β-hsd1 is increasingly seen as an attractive target for the treatment of type ii diabetes and other elements of the metabolic syndrome. in this program of work we describe how a series of neutral 2-thioalkyl-pyridine 11β-hsd1 inhibitors were optimized in terms of their pharmacokinetic properties to give compounds with excellent bioavailability in both rat and dog through a core change to pyrimidine. a potential reactive metabolite issue with 4-thioalkyl-pyrimidines was circumvented by a switch from sulfur to carbon substitution.,"scott js, gill al, godfrey l, groombridge sd, rees a, revill j, schofield p, sörme p, stocker a, swales jg, whittamore pr.",chembl_release:CHEMBL_16|creation_date:2013-05-07,,ChEMBL_36,PUBLICATION,CHEMBL2157961,10.1016/j.bmcl.2012.08.070,,2025-12-03T16:03:38.714071+00:00,6756,1b2432478bf173e16012796e2feb17aa0f45ae8ed4eee2a166bbe649cccd6fe4,a96e8105d54b52e78d846afdb7beea940539cc9532cebe5596a3b9b3e6231fa9,85,21,bioorg med chem lett,bioorganic & medicinal chemistry letters.,6761,,23013933,,1.0,optimisation of pharmacokinetic properties in a neutral series of 11β-hsd1 inhibitors.,22,2012.0
"11β-hydroxysteroid dehydrogenase 1 (11β-hsd1) has been a target of intensive research efforts across the pharmaceutical industry, due to its potential for the treatment of type ii diabetes and other elements of the metabolic syndrome. to demonstrate the value of 11β-hsd1 in preclinical models, we required inhibitors with good potency against both human and rodent isoforms. herein, we describe our efforts to understand how to co-optimize human and murine potency within the (5-hydroxy-2-adamantyl)-pyrimidine-5-carboxamide series. two approaches are described-a data-driven (free-wilson) analysis and a structure-based design approach. the conclusions from these approaches were used to inform an efficient campaign to design compounds with consistently good human/murine potency within a logd(7.4) range of 1-3. compounds 20 and 26 demonstrated good rodent pk, which allowed us to demonstrate a pk/pd relationship in rat and mouse. we then evaluated 26 against glycemic and body weight end points in murine disease models, where it demonstrated glucose and body weight efficacy at 300 mg/kg/day but only body weight efficacy at 50 mg/kg/day, despite providing >90% target engagement in the liver.","goldberg fw, leach ag, scott js, snelson wl, groombridge sd, donald cs, bennett sn, bodin c, gutierrez pm, gyte ac.",chembl_release:CHEMBL_16|creation_date:2013-05-07,,ChEMBL_36,PUBLICATION,CHEMBL2177079,10.1021/jm3013163,,2025-12-03T16:03:38.714071+00:00,10652,9ca6b7e001f15478e74ef67f6119302ad6411b5799cbcba2731bffc0774347e6,451de40f4b4aeb256aba96f7e66ce115525c7570f5d176b83db052fd0f2e3313,86,23,j med chem,journal of medicinal chemistry.,10661,,23153367,,1.0,free-wilson and structural approaches to co-optimizing human and rodent isoform potency for 11β-hydroxysteroid dehydrogenase type 1 (11β-hsd1) inhibitors.,55,2012.0
"(2s,3r)-n-[2-(pyridin-3-ylmethyl)-1-azabicyclo[2.2.2]oct-3-yl]benzo[b]furan-2-carboxamide (7a, tc-5619), a novel selective agonist of the α7 neuronal nicotinic acetylcholine receptor, has been identified as a promising drug candidate for the treatment of cognitive impairment associated with neurological disorders. 7a demonstrated more than a thousand-fold separation between the affinities for the α7 and α4β2 receptor subtypes and had no detectable effects on muscle or ganglionic nicotinic receptor subtypes, indicating a marked selectivity for the central nervous system over the peripheral nervous system. results obtained from homology modeling and docking explain the observed selectivity. 7a had positive effects across cognitive, positive, and negative symptoms of schizophrenia in animal models and was additive or synergistic with the antipsychotic clozapine. compound 7a, as an augmentation therapy to the standard treatment with antipsychotics, demonstrated encouraging results on measures of negative symptoms and cognitive dysfunction in schizophrenia and was well tolerated in a phase ii clinical proof of concept trial in patients with schizophrenia.","mazurov aa, kombo dc, hauser ta, miao l, dull g, genus jf, fedorov nb, benson l, sidach s, xiao y, hammond ps, james jw, miller ch, yohannes d.",chembl_release:CHEMBL_16|creation_date:2013-05-07,,ChEMBL_36,PUBLICATION,CHEMBL2177097,10.1021/jm301048a,,2025-12-03T16:03:38.714071+00:00,9793,974c6fd062f196c6fed21cfd8ae3d3e35735f2851d5eaec8beb18b0b6d515410,d4b57b1ddc649b16a36420468acdfd543a95b71b565717057cd973f73da8d1d7,25,22,j med chem,journal of medicinal chemistry.,9809,,23126648,,1.0,"discovery of (2s,3r)-n-[2-(pyridin-3-ylmethyl)-1-azabicyclo[2.2.2]oct-3-yl]benzo[b]furan-2-carboxamide (tc-5619), a selective α7 nicotinic acetylcholine receptor agonist, for the treatment of cognitive disorders.",55,2012.0
"11β-hydroxysteroid dehydrogenase type 1 (11β-hsd1) catalyzes the conversion of inactive glucocorticoid cortisone to its active form, cortisol. the glucocorticoid receptor (gr) signaling pathway has been linked to the pathophysiology of diabetes and metabolic syndrome. herein, the structure-activity relationship of a series of piperazine sulfonamide-based 11β-hsd1 inhibitors is described. (r)-3,3,3-trifluoro-2-(5-(((r)-4-(4-fluoro-2-(trifluoromethyl)phenyl)-2-methylpiperazin-1-yl)sulfonyl)thiophen-2-yl)-2-hydroxypropanamide 18a (hsd-621) was identified as a potent and selective 11β-hsd1 inhibitor and was ultimately selected as a clinical development candidate. hsd-621 has an attractive overall pharmaceutical profile and demonstrates good oral bioavailability in mouse, rat, and dog. when orally dosed in c57/bl6 diet-induced obesity (dio) mice, hsd-621 was efficacious and showed a significant reduction in both fed and fasting glucose and insulin levels. furthermore, hsd-621 was well tolerated in drug safety assessment studies.","wan zk, chenail e, li hq, ipek m, xiang j, suri v, hahm s, bard j, svenson k, xu x, tian x, wang m, li x, johnson ce, qadri a, panza d, perreault m, mansour ts, tobin jf, saiah e.",chembl_release:CHEMBL_17|creation_date:2013-08-29,,ChEMBL_36,PUBLICATION,CHEMBL2321820,10.1021/ml300352x,,2025-12-03T16:03:38.714071+00:00,118,94779ce9f118f3e0398ec9b29bdc6704c15720028c4f9f89422a42dd58021da4,d02c5fb038aa14984898ff555dd6c60d002608a8bb010e5c100d069ca56d1ecf,87,1,acs med chem lett,acs medicinal chemistry letters.,123,,24900572,,1.0,discovery of hsd-621 as a potential agent for the treatment of type 2 diabetes.,4,2013.0
"(-)-6-(7-methoxy-2-(trifluoromethyl)pyrazolo[1,5-a]pyridin-4-yl)-5-methyl-4,5-dihydropyridazin-3(2h)-one (kca-1490) exhibits moderate dual pde3/4-inhibitory activity and promises as a combined bronchodilatory/anti-inflammatory agent. n-alkylation of the pyridazinone ring markedly enhances potency against pde4 but suppresses pde3 inhibition. addition of a 6-aryl-4,5-dihydropyridazin-3(2h)-one extension to the n-alkyl group facilitates both enhancement of pde4-inhibitory activity and restoration of potent pde3 inhibition. both dihydropyridazinone rings, in the core and extension, can be replaced by achiral 4,4-dimethylpyrazolone subunits and the core pyrazolopyridine by isosteric bicyclic heteroaromatics. in combination, these modifications afford potent dual pde3/4 inhibitors that suppress histamine-induced bronchoconstriction in vivo and exhibit promising anti-inflammatory activity via intratracheal administration.","ochiai k, takita s, kojima a, eiraku t, iwase k, kishi t, ohinata a, yageta y, yasue t, adams dr, kohno y.",chembl_release:CHEMBL_17|creation_date:2013-08-29,,ChEMBL_36,PUBLICATION,CHEMBL2331441,10.1016/j.bmcl.2012.08.121,,2025-12-03T16:03:38.714071+00:00,375,b436bf73b1213b99c371f304feb502abf67e5f44b2543cc642196f4d6c8ec1ee,32b9d7c6ddea5c362db1277a0d613748dc15caf254e7ff19f54fe48a3a570b1e,18,1,bioorg med chem lett,bioorganic & medicinal chemistry letters.,381,,23200255,,1.0,phosphodiesterase inhibitors. part 5: hybrid pde3/4 inhibitors as dual bronchorelaxant/anti-inflammatory agents for inhaled administration.,23,2013.0
"(+)-laburnamine (1), a rare alkaloid extracted from laburnum anagyroides seeds (∼4 mg from 1 kg), was shown to bind with high affinity (ki, 293 nm) to the α4β2 nicotinic receptor subtype, which is, respectively, 126 and 136 times higher than to the α3β4 (ki 37 μm) and α7 subtypes (ki 40 μm). when its ability to release [(3)h]-dopamine from striatal slices was tested in a functional assay, compound 1 behaved as a partial agonist with an ec50 of 5.8 μm and an emax that was 43% that of nicotine. when incubated with nicotine in the same assay, 1 prevented a maximal effect from being reached.","tasso b, novelli f, sparatore f, fasoli f, gotti c.",chembl_release:CHEMBL_17|creation_date:2013-08-29,,ChEMBL_36,PUBLICATION,CHEMBL2331532,10.1021/np3007028,,2025-12-03T16:03:38.714071+00:00,727,bae7edb0dd76431d52e2aae6b22bd9bb107bbd8fe9bc3d6e1a8e897169bef9cb,fa66c0d3bb11d651fbe9e0b8daf1d8ec2496d6064e04f9ce6c3d2a8f0e69e792,7,4,j nat prod,journal of natural products.,731,,23461628,,1.0,"(+)-laburnamine, a natural selective ligand and partial agonist for the α4β2 nicotinic receptor subtype.",76,2013.0
"(-)-oleocanthal (1) and ligstroside aglycone (2) are common bioactive olive oil secoiridoids. secoiridoid 1 has been previously reported as a c-met inhibitor. chemically, (-)-oleocanthal is the elenolic acid ester of the common olive phenolic alcohol tyrosol. therefore, several analogues (4-13) were synthesized by esterification and carbamoylation of tyrosol using diverse phenolic naturally occurring in olive and heterocyclic acids as elenolic acid bioisosteres to assess the effect of replacing the acid moiety of (-)-oleocanthal. their c-met inhibitory activity as well as their antiproliferative, antimigratory, and anti-invasive activities against the highly metastatic human breast cancer cell line mda-mb231 has been assessed. ligstroside aglycone (2) showed the best antimigratory activity. generally, tyrosol esters showed better activities versus carbamate analogues. tyrosol sinapate (5) showed the best c-met phosphorylation inhibitory activity in z'-lyte kinase assay. both 1 and 5 competitively inhibited the atp binding into its pocket in the c-met catalytic domain. compound 5 showed selective activities against tumor cells without toxicity to the non-tumorigenic human breast mcf10a epithelial cell line. tyrosol esters with a phenolic acid containing hydrogen bond donor and/or acceptor groups at the para-position have better anticancer and c-met inhibitory activities. olive oil secoiridoids are excellent scaffolds for the design of novel c-met inhibitors.","busnena ba, foudah ai, melancon t, el sayed ka.",chembl_release:CHEMBL_17|creation_date:2013-08-29,,ChEMBL_36,PUBLICATION,CHEMBL2346504,10.1016/j.bmc.2012.12.050,,2025-12-03T16:03:38.714071+00:00,2117,b8f35b607af37a659abf762c0d8b2c3e37c6e1022ad08df2018a51dc21051577,c4eb9a90e4e998d44fae73fa566ddc079b46d42ac32851d36f10199ea79cddcb,26,7,bioorg med chem,bioorganic & medicinal chemistry.,2127,,23403296,,1.0,olive secoiridoids and semisynthetic bioisostere analogues for the control of metastatic breast cancer.,21,2013.0
"(e)-2-(3-(3-((3-bromophenyl)amino)-2-cyano-3-oxoprop-1-en-1-yl)-1h-indol-1-yl)acetic acid (1) was discovered in a hts campaign for crth2 receptor antagonists. an sar around this hit could be established and representatives with interesting activity profiles were obtained. ring closing tactics to convert this hit series into a novel 2,3,4,5-tetrahydro-1h-pyrido[4,3-b]indole based crth2 receptor antagonist series is presented.","valdenaire a, pothier j, renneberg d, riederer ma, peter o, leroy x, gnerre c, fretz h.",chembl_release:CHEMBL_18|creation_date:2014-03-12,,ChEMBL_36,PUBLICATION,CHEMBL2390869,10.1016/j.bmcl.2012.12.050,,2025-12-03T16:03:38.714071+00:00,944,b550cc996b803cdc9b9ad2a5b7cdb81f5fe3ad1b5bbe10e859a5e6c2205ad8b5,8a5a8969049eab8394cbca336ac8348b03d543a9190b1e90e55309d1563c3ec4,34,4,bioorg med chem lett,bioorganic & medicinal chemistry letters.,948,,23324405,,1.0,evolution of novel tricyclic crth2 receptor antagonists from a (e)-2-cyano-3-(1h-indol-3-yl)acrylamide scaffold.,23,2013.0
"1-(1,3,5-triazin-yl)piperidine-4-carboxamide inhibitors of soluble epoxide hydrolase were identified from high through-put screening using encoded library technology. the triazine heterocycle proved to be a critical functional group, essential for high potency and p450 selectivity. phenyl group substitution was important for reducing clearance, and establishing good oral exposure. based on this lead optimization work, 1-[4-methyl-6-(methylamino)-1,3,5-triazin-2-yl]-n-{[[4-bromo-2-(trifluoromethoxy)]-phenyl]methyl}-4-piperidinecarboxamide (27) was identified as a useful tool compound for in vivo investigation. robust effects on a serum biomarker, 9, 10-epoxyoctadec-12(z)-enoic acid (the epoxide derived from linoleic acid) were observed, which provided evidence of robust in vivo target engagement and the suitability of 27 as a tool compound for study in various disease models.","thalji rk, mcatee jj, belyanskaya s, brandt m, brown gd, costell mh, ding y, dodson jw, eisennagel sh, fries re, gross jw, harpel mr, holt da, israel di, jolivette lj, krosky d, li h, lu q, mandichak t, roethke t, schnackenberg cg, schwartz b, shewchuk lm, xie w, behm dj, douglas sa, shaw al, marino jp.",chembl_release:CHEMBL_18|creation_date:2014-03-12,,ChEMBL_36,PUBLICATION,CHEMBL2390902,10.1016/j.bmcl.2013.04.019,,2025-12-03T16:03:38.714071+00:00,3584,424e16e051a3573686a3eda99d53c4e787aa62253fb657fbabc7b31cbb573690,3a20168e44eac3304e913ec489f9927b6391a7538d5a875804eae725ce155e2f,65,12,bioorg med chem lett,bioorganic & medicinal chemistry letters.,3588,,23664879,,1.0,"discovery of 1-(1,3,5-triazin-2-yl)piperidine-4-carboxamides as inhibitors of soluble epoxide hydrolase.",23,2013.0
"(n)-methanocarba(bicyclo[3.1.0]hexane)adenosine derivatives were probed for sites of charged sulfonate substitution, which precludes diffusion across biological membranes, e.g., blood-brain barrier. molecular modeling predicted that sulfonate groups on c2-phenylethynyl substituents would provide high affinity at both mouse (m) and human (h) a3 adenosine receptors (ars), while a n(6)-p-sulfophenylethyl substituent would determine higher ha3ar vs ma3ar affinity. these modeling predictions, based on steric fitting of the binding cavity and crucial interactions with key residues, were confirmed by binding/efficacy studies of synthesized sulfonates. n(6)-3-chlorobenzyl-2-(3-sulfophenylethynyl) derivative 7 (mrs5841) bound selectively to h/m a3ars (ki(ha3ar) = 1.9 nm) as agonist, while corresponding p-sulfo isomer 6 (mrs5701) displayed mixed a1/a3ar agonism. both nucleosides administered ip reduced mouse chronic neuropathic pain that was ascribed to either a3ar or a1/a3ar using a3ar genetic deletion. thus, rational design methods based on a3ar homology models successfully predicted sites for sulfonate incorporation, for delineating adenosine's cns vs peripheral actions.","paoletta s, tosh dk, finley a, gizewski et, moss sm, gao zg, auchampach ja, salvemini d, jacobson ka.",chembl_release:CHEMBL_18|creation_date:2014-03-12,,ChEMBL_36,PUBLICATION,CHEMBL2401698,10.1021/jm4007966,,2025-12-03T16:03:38.714071+00:00,5949,45490fb5d99a4b4b43e2d7be37ccdd61fac710ade19d4952a7bfd1fef90589b7,5a18e25e9c0f8d1ec3c8a5c092c57527fed8ffacef4344ee4830a0a3ad1f8239,46,14,j med chem,journal of medicinal chemistry.,5963,,23789857,,1.0,rational design of sulfonated a3 adenosine receptor-selective nucleosides as pharmacological tools to study chronic neuropathic pain.,56,2013.0
"17-cyclopropylmethyl-3,14β-dihydroxy-4,5α-epoxy-6α-(isoquinoline-3'-carboxamido)morphinan (naq) was previously designed following the 'message-address' concept and was identified as a potent and highly selective mu opioid receptor (mor) ligand based on its pharmacological profile. we here report the preliminary structure activity relationship (sar) studies of this novel lead compound. for the new ligands synthesized as naq analogues, their binding assay results showed that a longer spacer and a saturated ring system of the side chain were unfavorable for their mor selectivity over the kappa and delta opioid receptors. in contrast, substitutions with different electronic properties at either 1'- or 4'-position of the isoquinoline ring of the side chain were generally acceptable for reasonable mor selectivity. the majority of naq analogues retained low efficacy at the mor compared to naq in the (35)s-gtp[γs] binding assays while electron-withdrawing groups at 1'-position of the isoquinoline ring induced higher mor stimulation than electron-donating groups did. in summary, the electronic characteristics of substituents at 1'- or 4'-position of the isoquinoline ring in naq seem to be critical and need to be further tuned up to achieve higher mor selectivity and lower mor stimulation.","yuan y, elbegdorj o, beletskaya io, selley de, zhang y.",chembl_release:CHEMBL_18|creation_date:2014-03-12,,ChEMBL_36,PUBLICATION,CHEMBL2417375,10.1016/j.bmcl.2013.07.043,,2025-12-03T16:03:38.714071+00:00,5045,375bc02a874b63867a5c801ba19811a353663df534b5eac8475d104b1040c75f,6fd65e4fcfd1b36726677400ebf8972bd57ecac391efd521096067a938ba418d,97,18,bioorg med chem lett,bioorganic & medicinal chemistry letters.,5048,,23948248,,1.0,"structure activity relationship studies of 17-cyclopropylmethyl-3,14β-dihydroxy-4,5α-epoxy-6α-(isoquinoline-3'-carboxamido)morphinan (naq) analogues as potent opioid receptor ligands: preliminary results on the role of electronic characteristics for affinity and function.",23,2013.0
"11β-hydroxysteroid dehydrogenase type 1 (11β-hsd1) has been widely considered by the pharmaceutical industry as a target to treat metabolic syndrome in type ii diabetics. we hypothesized that central nervous system (cns) penetration might be required to see efficacy. starting from a previously reported pyrimidine compound, we removed hydrogen-bond donors to yield 3, which had modest cns penetration. more significant progress was achieved by changing the core to give 40, which combines good potency and cns penetration. compound 40 was dosed to diet-induced obese (dio) mice and gave excellent target engagement in the liver and high free exposures of drug, both peripherally and in the cns. however, no body weight reduction or effects on glucose or insulin were observed in this model. similar data were obtained with a structurally diverse thiazole compound 51. this work casts doubt on the hypothesis that localized tissue modulation of 11β-hsd1 activity alleviates metabolic syndrome.","goldberg fw, dossetter ag, scott js, robb gr, boyd s, groombridge sd, kemmitt pd, sjögren t, gutierrez pm, deschoolmeester j, swales jg, turnbull av, wild mj.",chembl_release:CHEMBL_19|creation_date:2014-07-03,,ChEMBL_36,PUBLICATION,CHEMBL3124933,10.1021/jm4016729,,2025-12-03T16:03:38.714071+00:00,970,a475dae488b02cd9efcffc46640d8abf818466520c10dde10b81ccc7917bdb13,3de266d74be93994bf446d32ade94fc205683b26098582f4f50520f5ec8295e6,88,3,j med chem,journal of medicinal chemistry.,986,,24422550,,1.0,optimization of brain penetrant 11β-hydroxysteroid dehydrogenase type i inhibitors and in vivo testing in diet-induced obese mice.,57,2014.0
"11β-hydroxysteroid dehydrogenase type 1 (11β-hsd1) is the enzyme primarily responsible for the regulation of intracellular cortisol levels. inhibition of 11β-hsd1 is an attractive mechanism for the treatment of obesity and other elements of the metabolic syndrome. emerging literature also supports a potential role in the treatment of other unmet medical needs including alzheimer's disease, vascular inflammation, cardiovascular disease, and glaucoma. the aim of this article is to review the medicinal chemistry literature around small molecule approaches to developing synthetic inhibitors of 11β-hsd1 and to highlight key compounds that have resulted from the efforts of both industrial and academic groups. the reported data from 11β-hsd1 inhibitors that have progressed into the clinic are summarized followed by a perspective from the authors.","scott js, goldberg fw, turnbull av.",chembl_release:CHEMBL_20|creation_date:2015-01-14,,ChEMBL_36,PUBLICATION,CHEMBL3286258,10.1021/jm4014746,,2025-12-03T16:03:38.714071+00:00,4466,1074a87aade506dd2252316864db34578be1cce790b53670b2defb3464815f9b,9971bd63042a7e15904ae66fa42b3378e5dd3f507a19114117c622b1a5c18beb,89,11,j med chem,journal of medicinal chemistry.,4486,,24294985,,1.0,medicinal chemistry of inhibitors of 11β-hydroxysteroid dehydrogenase type 1 (11β-hsd1).,57,2014.0
"(±)-torreyunlignans a-d (1a/1b-4a/4b), four pairs of new 8-9' linked neolignan enantiomers featuring a rare (e)-2-styryl-1,3-dioxane moiety, were isolated from the trunk of torreya yunnanensis. the structures were determined by combined spectroscopic and chemical methods, and the absolute configurations were elucidated by ecd calculations. the compounds were screened by using tritium-labeled adenosine 3',5'-cyclic monophosphate ([(3)h]-cgmp) as a substrate for inhibitory affinities against phosphodiesterase-9a (pde9a), which is a potential target for the treatment of diabetes and alzheimer's disease. all of the enantiomers exhibited inhibition against pde9a with ic50 values ranging from 5.6 to 15.0 μm. this is the first report of pde9a inhibitors from nature.","cheng zb, lu x, bao jm, han qh, dong z, tang gh, gan ls, luo hb, yin s.",chembl_release:CHEMBL_21|creation_date:2016-02-01,,ChEMBL_36,PUBLICATION,CHEMBL3351446,10.1021/np500528u,,2025-12-03T16:03:38.714071+00:00,2651,651e742d5293c1b80769944d9e2da75458426334893491e62b3964d9128fae65,9bfc0ea606e1fcf51c806173fad0c31d0b4751e6815410aeb9a5563d2f64ee25,57,12,j nat prod,journal of natural products.,2657,,25495612,,1.0,"(±)-torreyunlignans a-d, rare 8-9' linked neolignan enantiomers as phosphodiesterase-9a inhibitors from torreya yunnanensis.",77,2014.0
"1-phenylsulfinyl-3-(pyridin-3-yl)naphthalen-2-ols and related compounds were synthesized and evaluated for inhibition of aldosterone synthase (cyp11b2), a potential target for cardiovascular diseases associated with elevated plasma aldosterone levels like congestive heart failure and myocardial fibrosis. introduction of substituents at the phenylsulfinyl moiety and changes of the substitution pattern at the naphthalene core were examined. potent compounds were further examined for selectivity versus other important steroidogenic cyp enzymes, i.e. the highly homologous 11β-hydroxylase (cyp11b1), cyp17 and cyp19. the most potent compound (ic50 = 14 nm) discovered was the meta-trifluoromethoxy derivative 11, which also exhibited excellent selectivity toward cyp11b1 (sf = 415), and showed no inhibition of cyp17 and cyp19.","grombein cm, hu q, heim r, rau s, zimmer c, hartmann rw.",chembl_release:CHEMBL_21|creation_date:2016-02-01,,ChEMBL_36,PUBLICATION,CHEMBL3352541,10.1016/j.ejmech.2014.10.027,,2025-12-03T16:03:38.714071+00:00,597,bdbf0ab0ba81a00426a5cb2c8af0073195deaed5b38b6c37fe957b775f01fe59,c030939947b89e529cf684c86aa4b439528fc46a310ff6f3228438269c185027,78,,eur j med chem,european journal of medicinal chemistry.,605,,25462268,,1.0,1-phenylsulfinyl-3-(pyridin-3-yl)naphthalen-2-ols: a new class of potent and selective aldosterone synthase inhibitors.,89,2015.0
"(1sr,4rs)-3,3-dimethyl-1,2,3,4-tetrahydro-1,4-(epiminomethano)naphthalenes were synthesized in 2-3 steps from commercially available materials and assessed for specificity and effectiveness across a range of nox isoforms. the n-pentyl and n-methylenethiophene substituted analogs 11g and 11h emerged as selective nox2 inhibitors with cellular ic50 values of 20 and 32 μm, respectively.","cifuentes-pagano e, saha j, csányi g, ghouleh ia, sahoo s, rodríguez a, wipf p, pagano pj, skoda em.",chembl_release:CHEMBL_21|creation_date:2016-02-01,,ChEMBL_36,PUBLICATION,CHEMBL3390837,10.1039/c3md00061c,,2025-12-03T16:03:38.714071+00:00,1085,f7da44dd6ffcd6ce2b9cc3a730e91990409631982c8a0a545eb47c3a590b5d60,7211ad6682365408e08570c15a3ddf2ed89c17c5d4df12f4eef86897de50b029,27,7,medchemcomm,,1092,,24466406,,1.0,bridged tetrahydroisoquinolines as selective nadph oxidase 2 (nox2) inhibitors.,4,2013.0
